{
  "$schema": "../../schemas/embedding_index_manifest_v1.schema.json",
  "batch_size": 32,
  "canonical_gold_file": "data/gold/mit_60001/chunks.jsonl",
  "canonical_gold_manifest_file": "reports/08_chunking/canonical_gold_manifest.json",
  "canonical_gold_manifest_sha256": "1fad01e0ed7f62cc23b3ef744a3d462f286970cf198836a35ec3498b27f207ee",
  "canonical_gold_sha256": "c03abf002c29b784d191eb393670da27b80fed8e0e18798f113d7ff8b7daf432",
  "chunk_count": 861,
  "chunk_id_order_sha256": "3d1d9d68fd8c9039d2a30ffe92933bb4e71c6488f8a60598998749945fa895db",
  "embedding_dimension": 384,
  "embedding_dtype": "float32",
  "embedding_shape": [
    861,
    384
  ],
  "embeddings_file": "data/indexes/mit_60001/embeddings.npy",
  "embeddings_sha256": "3cf94fd32adf78e1e294d5562910f0d7144744a4c310de30f74f0084c80e56a7",
  "index_backend": "numpy_exact_cosine_v1",
  "index_content_sha256": "6e78f39257b7cc5defebd6740aab2dc1a4c202165b073f7a740ee5a5d7c46805",
  "index_created_at_utc": "2026-08-12T16:22:33Z",
  "index_run_id": "mit60001_index_558e4d6e873847dd",
  "index_version": "mit60001_exact_dense_v1",
  "metadata_file": "data/indexes/mit_60001/metadata.jsonl",
  "metadata_record_count": 861,
  "metadata_sha256": "376faf54d90b6c4a30dc562aeba2127cbdd2953c243cd341bc288068dce4c7d7",
  "model_max_sequence_length": 256,
  "model_repository": "sentence-transformers/all-MiniLM-L6-v2",
  "model_revision": "1110a243fdf4706b3f48f1d95db1a4f5529b4d41",
  "nonfinite_value_count": 0,
  "norm_tolerance": 1e-05,
  "norm_violation_count": 0,
  "normalize_embeddings": true,
  "numpy_version": "2.4.3",
  "python_version": "3.12.10",
  "schema_version": "embedding_index_manifest_v1",
  "scope_version": "mit_60001_fall_2016_v1",
  "selected_chunking_config_id": "semantic_cosine_wp240_v1",
  "sentence_transformers_version": "5.4.1",
  "similarity": "cosine_via_dot_product_of_l2_normalized_vectors",
  "torch_version": "2.11.0+cpu",
  "transformers_version": "5.6.2",
  "validation_status": "passed",
  "video_count": 38,
  "zero_norm_vector_count": 0
}
